{
  "version": "1",
  "package": {
    "name": "datasqrl.examples.Nutshop",
    "version": "1.0.0",
    "variant": "dev",
    "latest": true,
    "description": "Basic nutshop example",
    "topics": ["example", "tutorial", "ecommerce"]
  },
  "compiler": {
    "addArguments": false,
    "explain": {
      "visual": true,
      "text": false,
      "sorted": true
    }
  },
  "engines": {
    "flink": {
      "connectors": {
        "postgres": {
          "connector": "jdbc-sqrl",
          "password": "${JDBC_PASSWORD}",
          "driver": "org.postgresql.Driver",
          "username": "${JDBC_USERNAME}",
          "url": "${JDBC_URL}",
          "table-name": "${sqrl:table}"
        }
      }
    }
  },
  "dependencies": [{
    "datasqrl.examples.Shared": {
      "version": "1.0.0",
      "variant": "dev"
    },
    "datasqrl.examples.Basic": {
      "version": "1.0.0"
    }
  }]
}
